{
  "tool_version": "0.1.0",
  "timestamp_utc": "2026-03-29T23:44:20.545324600+00:00",
  "platform": "windows",
  "command": "timeline",
  "args": [],
  "status": "ok",
  "exit_code": 0,
  "error": null,
  "warning": null,
  "outputs": {},
  "sizes": {},
  "elapsed_ms": 31,
  "data": {
    "case_id": "test_case_contract_timeline",
    "db_path": "tests_temp_contract_timeline/test_case.sqlite",
    "from_utc": null,
    "to_utc": null,
    "cursor": null,
    "next_cursor": null,
    "limit": 50,
    "source_filter": "execution",
    "total_available": 1,
    "total_returned": 1,
    "inputs": {
      "severity": null,
      "event_type": null,
      "contains": null,
      "prefetch_dir": "tests_temp_contract_timeline/prefetch",
      "prefetch_found": true,
      "jumplist_path": "tests_temp_contract_timeline/sample.automaticdestinations-ms",
      "jumplist_found": true,
      "lnk_input": "exports\\shortcuts.json",
      "lnk_found": false,
      "browser_input": "exports\\browser.json",
      "browser_found": false,
      "rdp_input": "exports\\rdp.csv",
      "rdp_found": false,
      "usb_input": "exports\\usb.json",
      "usb_found": false,
      "restore_shadow_input": "exports\\restore_shadow.json",
      "restore_shadow_found": false,
      "user_activity_input": "exports\\user_activity_mru.json",
      "user_activity_found": false,
      "timeline_correlation_input": "exports\\timeline_correlation_qa.json",
      "timeline_correlation_found": false,
      "srum_input": "artifacts\\srum\\srum.json",
      "srum_found": false,
      "evtx_security_input": "artifacts\\security\\Security.evtx",
      "evtx_security_found": false,
      "evtx_sysmon_input": "artifacts\\security\\Sysmon.evtx",
      "evtx_sysmon_found": false,
      "powershell_history": "C:\\Users\\korby\\AppData\\Roaming\\Microsoft\\Windows\\PowerShell\\PSReadLine\\ConsoleHost_history.txt",
      "powershell_history_found": true,
      "powershell_script_log": "artifacts\\powershell\\script_block.log",
      "powershell_script_log_found": false,
      "powershell_events": "artifacts\\powershell\\ps_events.json",
      "powershell_events_found": false,
      "defender_input": "exports\\defender_artifacts.json",
      "defender_found": false
    },
    "quality": {
      "totals": {
        "rows_prefilter": 1,
        "rows_after_filters": 1,
        "rows_dropped_by_filters": 0,
        "rows_returned_page": 1
      },
      "rows_by_source": {
        "execution": {
          "rows_scanned": 1,
          "rows_timestamped": 1,
          "rows_dropped": 0,
          "rows_after_filters": 1,
          "rows_returned": 1,
          "rows_returned_timestamped": 1
        }
      }
    },
    "counts_by_source": {
      "activity": 0,
      "evidence": 0,
      "violations": 0,
      "execution": 1,
      "prefetch": 0,
      "jumplist": 0,
      "lnk_shortcuts": 0,
      "browser_forensics": 0,
      "rdp_remote_access": 0,
      "usb_device_history": 0,
      "restore_shadow_copies": 0,
      "user_activity_mru": 0,
      "timeline_correlation_qa": 0,
      "srum": 0,
      "evtx_security": 0,
      "evtx_sysmon": 0,
      "powershell": 0,
      "registry_user_hives": 0,
      "registry_persistence": 0,
      "shimcache": 0,
      "amcache": 0,
      "bam_dam": 0,
      "services_drivers": 0,
      "scheduled_tasks": 0,
      "wmi_persistence": 0,
      "ntfs_mft": 0,
      "usn_journal": 0,
      "ntfs_logfile": 0,
      "recycle_bin": 0,
      "defender_artifacts": 0
    },
    "events": [
      {
        "id": "execution-cmd.exe-1700000000",
        "source": "execution",
        "timestamp_utc": "2023-11-14T22:13:20+00:00",
        "timestamp_unix": 1700000000,
        "event_type": "recent-execution",
        "event_category": "execution-correlation",
        "summary": "cmd.exe observed via jumplist,prefetch (hits=2)",
        "severity": "info",
        "case_id": "test_case_contract_timeline",
        "source_module": "execution-correlation",
        "source_record_id": "cmd.exe",
        "data_json": "{\"sources\":[\"jumplist\",\"prefetch\"],\"prefetch_count\":1,\"jumplist_count\":1,\"shortcut_count\":0,\"total_hits\":2,\"first_seen_unix\":1700000000,\"first_seen_utc\":\"2023-11-14T22:13:20+00:00\",\"last_seen_unix\":1700000000,\"last_seen_utc\":\"2023-11-14T22:13:20+00:00\",\"latest_prefetch_unix\":1700000000,\"latest_jumplist_unix\":null,\"latest_shortcut_unix\":null,\"sample_paths\":[\"CMD.EXE\",\"C:\\\\Windows\\\\System32\\\\cmd.exe\"]}"
      }
    ]
  }
}