{
  "tool_version": "0.1.0",
  "timestamp_utc": "2026-03-13T01:50:05.384585800+00:00",
  "platform": "windows",
  "command": "timeline",
  "args": [
    "--case",
    "test_case_timeline_wmi",
    "--db",
    "tests_temp_timeline_wmi_persistence_source/test_case.sqlite",
    "--source",
    "wmi-persistence",
    "--wmi-persist-input",
    "tests_temp_timeline_wmi_persistence_source/persistence.json",
    "--wmi-traces-input",
    "tests_temp_timeline_wmi_persistence_source/traces.json",
    "--wmi-instances-input",
    "tests_temp_timeline_wmi_persistence_source/instances.json",
    "--json-result",
    "tests_temp_timeline_wmi_persistence_source/timeline_wmi_result.json",
    "--quiet"
  ],
  "status": "ok",
  "exit_code": 0,
  "error": null,
  "warning": null,
  "outputs": {},
  "sizes": {},
  "elapsed_ms": 38,
  "data": {
    "case_id": "test_case_timeline_wmi",
    "counts_by_source": {
      "activity": 0,
      "amcache": 0,
      "bam_dam": 0,
      "browser_forensics": 0,
      "defender_artifacts": 0,
      "evidence": 0,
      "evtx_security": 0,
      "evtx_sysmon": 0,
      "execution": 0,
      "jumplist": 0,
      "lnk_shortcuts": 0,
      "ntfs_logfile": 0,
      "ntfs_mft": 0,
      "powershell": 0,
      "prefetch": 0,
      "rdp_remote_access": 0,
      "recycle_bin": 0,
      "registry_persistence": 0,
      "registry_user_hives": 0,
      "restore_shadow_copies": 0,
      "scheduled_tasks": 0,
      "services_drivers": 0,
      "shimcache": 0,
      "srum": 0,
      "timeline_correlation_qa": 0,
      "usb_device_history": 0,
      "user_activity_mru": 0,
      "usn_journal": 0,
      "violations": 0,
      "wmi_persistence": 3
    },
    "cursor": null,
    "db_path": "tests_temp_timeline_wmi_persistence_source/test_case.sqlite",
    "events": [
      {
        "case_id": "test_case_timeline_wmi",
        "data_json": "{\"namespace\":\"root\\\\subscription\"}",
        "event_category": "activity",
        "event_type": "wmi-trace",
        "id": "wmi-trace-1700002222-0",
        "severity": "info",
        "source": "wmi-persistence",
        "source_module": "wmi-persistence-activity",
        "summary": "WMI trace: root\\subscription",
        "timestamp_unix": 1700002222,
        "timestamp_utc": "2023-11-14T22:50:22+00:00"
      },
      {
        "case_id": "test_case_timeline_wmi",
        "data_json": "{\"class_name\":\"Win32_Process\",\"property_count\":1}",
        "event_category": "wmi",
        "event_type": "wmi-class-instance",
        "id": "wmi-instance-0",
        "severity": "info",
        "source": "wmi-persistence",
        "source_module": "wmi-persistence-activity",
        "summary": "WMI class instance: Win32_Process",
        "timestamp_unix": 0,
        "timestamp_utc": "unknown"
      },
      {
        "case_id": "test_case_timeline_wmi",
        "data_json": "{\"consumer\":\"cmd.exe /c beacon.ps1\",\"filter\":\"SELECT * FROM __InstanceCreationEvent\"}",
        "event_category": "persistence",
        "event_type": "wmi-persistence-binding",
        "id": "wmi-persist-0",
        "severity": "warn",
        "source": "wmi-persistence",
        "source_module": "wmi-persistence-activity",
        "summary": "WMI persistence binding: cmd.exe /c beacon.ps1",
        "timestamp_unix": 0,
        "timestamp_utc": "unknown"
      }
    ],
    "from_utc": null,
    "inputs": {
      "browser_found": false,
      "browser_input": "exports\\browser.json",
      "contains": null,
      "defender_found": false,
      "defender_input": "exports\\defender_artifacts.json",
      "event_type": null,
      "evtx_security_found": false,
      "evtx_security_input": "artifacts\\security\\Security.evtx",
      "evtx_sysmon_found": false,
      "evtx_sysmon_input": "artifacts\\security\\Sysmon.evtx",
      "jumplist_found": true,
      "jumplist_path": "C:\\Users\\korby\\AppData\\Roaming\\Microsoft\\Windows\\Recent\\AutomaticDestinations",
      "lnk_found": false,
      "lnk_input": "exports\\shortcuts.json",
      "powershell_events": "artifacts\\powershell\\ps_events.json",
      "powershell_events_found": false,
      "powershell_history": "C:\\Users\\korby\\AppData\\Roaming\\Microsoft\\Windows\\PowerShell\\PSReadLine\\ConsoleHost_history.txt",
      "powershell_history_found": true,
      "powershell_script_log": "artifacts\\powershell\\script_block.log",
      "powershell_script_log_found": false,
      "prefetch_dir": "C:\\Windows\\Prefetch",
      "prefetch_found": true,
      "rdp_found": false,
      "rdp_input": "exports\\rdp.csv",
      "restore_shadow_found": false,
      "restore_shadow_input": "exports\\restore_shadow.json",
      "severity": null,
      "srum_found": false,
      "srum_input": "artifacts\\srum\\srum.json",
      "timeline_correlation_found": false,
      "timeline_correlation_input": "exports\\timeline_correlation_qa.json",
      "usb_found": false,
      "usb_input": "exports\\usb.json",
      "user_activity_found": false,
      "user_activity_input": "exports\\user_activity_mru.json"
    },
    "limit": 200,
    "next_cursor": null,
    "quality": {
      "rows_by_source": {
        "wmi-persistence": {
          "rows_after_filters": 3,
          "rows_dropped": 0,
          "rows_returned": 3,
          "rows_returned_timestamped": 1,
          "rows_scanned": 3,
          "rows_timestamped": 1
        }
      },
      "totals": {
        "rows_after_filters": 3,
        "rows_dropped_by_filters": 0,
        "rows_prefilter": 3,
        "rows_returned_page": 3
      }
    },
    "source_filter": "wmi-persistence",
    "to_utc": null,
    "total_available": 3,
    "total_returned": 3
  }
}